{
  "format": "szenentyp/1",
  "id": "annaeherung_und_erkundung",
  "kennung": "A2",
  "name": "Annäherung & Erkundung",
  "bereich": "weltraum",
  "kern": "Unbekannten Ort anfliegen, scannen, Funde machen, Lage klären",
  "kippt_zu": [
    "begegnung",
    "raumgefecht"
  ],
  "braucht": [
    "sternkarte_sprung",
    "captain_scan",
    "weitscan"
  ],
  "molekuele_plaetze": {
    "min": 1,
    "max": 2
  },
  "quelle": "vault: Bausteine/Szenentypen.md"
}