{
  "format": "szenentyp/1",
  "id": "gefahrennavigation",
  "kennung": "A7",
  "name": "Gefahrennavigation",
  "bereich": "weltraum",
  "kern": "Gelände ist der Gegner: Nebel, Asteroiden, Minenfeld, Gravitationsfeld, Sonneneruption, Anomalie",
  "kippt_zu": [
    "raumgefecht"
  ],
  "braucht": [
    "gelaende"
  ],
  "molekuele_plaetze": {
    "min": 1,
    "max": 2
  },
  "quelle": "vault: Bausteine/Szenentypen.md"
}